💾 Logging aktiv: 20250618_1832_verarbeitung_log.txt
🧪 Aktive Version: Patchstand 20250618_1445
 Starte Verarbeitung mit Zwischenspeicherung und Batch-Limit...
📂 3 Dateien gefunden.

════════════════════════════════════════════════════════════
️ 1/3: DE51BNOM9AEUI.pdf
🛂 Starte Vorprüfung der Datei
 Textlayer vorhanden: NEIN
⚠️ Kein brauchbarer Text erkannt – wechsle zu GPT-OCR
🔠 Starte GPT-Klassifikation auf Bildbasis (OCR)
📤 Sende Bild direkt an GPT zur Inhaltsextraktion …
📤 Sende Bild an GPT zur Inhaltsextraktion …
✅ Starte Plausibilitätsprüfung der Tabelle …


️ 2/3: DE56GWMABEC.pdf
🛂 Starte Vorprüfung der Datei
 Textlayer vorhanden: NEIN
⚠️ Kein brauchbarer Text erkannt – wechsle zu GPT-OCR
🔠 Starte GPT-Klassifikation auf Bildbasis (OCR)
📤 Sende Bild direkt an GPT zur Inhaltsextraktion …
📤 Sende Bild an GPT zur Inhaltsextraktion …
✅ Starte Plausibilitätsprüfung der Tabelle …


️ 3/3: DE_25022865_073835.pdf
🛂 Starte Vorprüfung der Datei
 Textlayer vorhanden: JA
🔠 Starte GPT-Klassifikation auf Textbasis
📤 Sende Bild direkt an GPT zur Inhaltsextraktion …
📤 Sende Text an GPT zur Inhaltsextraktion …
✅ Starte Plausibilitätsprüfung der Tabelle …


🔧 Harmonisiere Einheiten & Artikelbezeichnungen mit Mapping + Logging ...
📄 Mapping-Datei nicht gefunden – leeres Template wird angelegt: mein_mapping.xlsx
📄 Mapping-Datei geladen: mein_mapping.xlsx
🧠 Formatiere und korrigiere Zahlen …
🧠 Starte globale Artikel-Kategorisierung mit GPT und Log-Wiederverwendung …

❌ Fehler in 'Kategorisierung':
Traceback (most recent call last):
  File "C:\Users\Sascha.Detke\AppData\Local\Programs\Python\Python312\Lib\site-packages\pandas\core\indexes\base.py", line 3812, in get_loc
    return self._engine.get_loc(casted_key)
           ^^^^^^^^^^^^^^^^^^^^^^^^^^^^^^^^
  File "pandas/_libs/index.pyx", line 167, in pandas._libs.index.IndexEngine.get_loc
  File "pandas/_libs/index.pyx", line 196, in pandas._libs.index.IndexEngine.get_loc
  File "pandas/_libs/hashtable_class_helper.pxi", line 7088, in pandas._libs.hashtable.PyObjectHashTable.get_item
  File "pandas/_libs/hashtable_class_helper.pxi", line 7096, in pandas._libs.hashtable.PyObjectHashTable.get_item
KeyError: 'Artikelbezeichnung'

The above exception was the direct cause of the following exception:

Traceback (most recent call last):
  File "C:\Users\Sascha.Detke\OneDrive - Seier Gruppe\Dokumente\RechnungsExtraktionKI\main.py", line 122, in sicher_ausführen
    return funktion(*args, **kwargs)
           ^^^^^^^^^^^^^^^^^^^^^^^^^
  File "C:\Users\Sascha.Detke\OneDrive - Seier Gruppe\Dokumente\RechnungsExtraktionKI\main.py", line 358, in kategorisiere_artikel_global
    artikel = df["Artikelbezeichnung"].dropna().unique()
              ~~^^^^^^^^^^^^^^^^^^^^^^
  File "C:\Users\Sascha.Detke\AppData\Local\Programs\Python\Python312\Lib\site-packages\pandas\core\frame.py", line 4107, in __getitem__
    indexer = self.columns.get_loc(key)
              ^^^^^^^^^^^^^^^^^^^^^^^^^
  File "C:\Users\Sascha.Detke\AppData\Local\Programs\Python\Python312\Lib\site-packages\pandas\core\indexes\base.py", line 3819, in get_loc
    raise KeyError(key) from err
KeyError: 'Artikelbezeichnung'



════════════════════════════════════════════════════════════
🌟 Verarbeitung beendet: 3 Dateien in 19.5s

📊 Verarbeitungsstatistik:

📜 Ø/Datei: 6.49s
📄 Textbasiert: 1 (33.3%), Ø 0.00s
🧠 GPT-OCR: 2 (66.7%), Ø 0.00s
❌ Nicht-Rechnungen: 0 (0.0%)
⚠️ Probleme: 0 (0.0%)

🧾 Zusammenfassung nach Skriptlauf:
⚠️ Es sind folgende Fehler aufgetreten:

❌ Fehler in 'Kategorisierung':
Traceback (most recent call last):
  File "C:\Users\Sascha.Detke\AppData\Local\Programs\Python\Python312\Lib\site-packages\pandas\core\indexes\base.py", line 3812, in get_loc
    return self._engine.get_loc(casted_key)
           ^^^^^^^^^^^^^^^^^^^^^^^^^^^^^^^^
  File "pandas/_libs/index.pyx", line 167, in pandas._libs.index.IndexEngine.get_loc
  File "pandas/_libs/index.pyx", line 196, in pandas._libs.index.IndexEngine.get_loc
  File "pandas/_libs/hashtable_class_helper.pxi", line 7088, in pandas._libs.hashtable.PyObjectHashTable.get_item
  File "pandas/_libs/hashtable_class_helper.pxi", line 7096, in pandas._libs.hashtable.PyObjectHashTable.get_item
KeyError: 'Artikelbezeichnung'

The above exception was the direct cause of the following exception:

Traceback (most recent call last):
  File "C:\Users\Sascha.Detke\OneDrive - Seier Gruppe\Dokumente\RechnungsExtraktionKI\main.py", line 122, in sicher_ausführen
    return funktion(*args, **kwargs)
           ^^^^^^^^^^^^^^^^^^^^^^^^^
  File "C:\Users\Sascha.Detke\OneDrive - Seier Gruppe\Dokumente\RechnungsExtraktionKI\main.py", line 358, in kategorisiere_artikel_global
    artikel = df["Artikelbezeichnung"].dropna().unique()
              ~~^^^^^^^^^^^^^^^^^^^^^^
  File "C:\Users\Sascha.Detke\AppData\Local\Programs\Python\Python312\Lib\site-packages\pandas\core\frame.py", line 4107, in __getitem__
    indexer = self.columns.get_loc(key)
              ^^^^^^^^^^^^^^^^^^^^^^^^^
  File "C:\Users\Sascha.Detke\AppData\Local\Programs\Python\Python312\Lib\site-packages\pandas\core\indexes\base.py", line 3819, in get_loc
    raise KeyError(key) from err
KeyError: 'Artikelbezeichnung'

❌ Kategorisierung schlug fehl. Verarbeitung abgebrochen.

📋 Bitte behebe die Fehler und starte das Skript erneut.

❌ Kritischer Fehler erkannt: Verarbeitung wurde bewusst abgebrochen.
📋 Bitte Ursache beheben (siehe 20250618_1832_fehlerprotokoll.txt), dann erneut starten.
